{
  "checked": true,
  "executed": false,
  "execution_status": "blocked",
  "operating_mode": "advisory",
  "executable_path": "C:/example/gauss26/tgauss.exe",
  "gauss_version": "GAUSS 26",
  "working_directory": null,
  "command": null,
  "code_source": "inline",
  "script_path": null,
  "timeout_seconds": 30,
  "elapsed_seconds": 0,
  "exit_code": null,
  "stdout": "",
  "stderr": "",
  "output_files": [],
  "warnings": [
    "Synthetic example output; no real GAUSS code was executed."
  ],
  "errors": [
    "Execution was blocked because no safe working_directory was supplied; execution requires an explicit working directory and cannot proceed without one."
  ],
  "next_steps": [
    "Provide an explicit, existing working_directory scoped to this execution request.",
    "Create a dedicated safe working directory if one does not already exist.",
    "Continue in Advisory Mode; code generation, explanation, and review remain fully available."
  ]
}
